{
  "contract_version": "1.0",
  "generator_version": "0.0.1",
  "validator_version": "0.0.1",
  "generated_at": "2026-08-11T00:05:00+00:00",
  "release_identity": {
    "application_slug": "timeout-app",
    "version": "1.0.0",
    "release_fingerprint": "sha256:6d310d143c63711ab56d83ee0737ebd1c72ebf1c55997e74c745db983694416a"
  },
  "validation_environment": "Platform Golden Fixture Generator",
  "overall_result": "PASS",
  "summary": {
    "rules_executed": 1,
    "rules_passed": 1,
    "rules_failed": 0,
    "rules_not_applicable": 0,
    "rules_not_executed": 0
  },
  "rules": [
    {
      "id": "RC-CON-001",
      "category": "RC-CON",
      "result": "PASS",
      "message": "Synthetic Golden Fixture."
    }
  ]
}
